"#starttime";"#endtime";"transcription";"sentimentAnnotations"
0.000;6.643;"Y lo que me encanto de esta pelicula es que es:te recurso lo utilizan m:uy, bien porque la c- calidad de la imagen se ve muy bien";"1"
6.643;17.290;"luego pues cada tenemos esta historia que esta muy: interesante, la verdad es que desde el principio te atrapa y toda la pelicula yo la neta no queria que se acabara la pelicula porque es dia de que tiene super poderes y ahora:, que voy a hacer con ellos ";"1"
17.290;23.475;"esta su:per interesante, porque ya: la neta todos siempre queremos tener superpoderes y vivimos pensando que algun dia vamos a tener superpoderes.";"1"
23.475;26.714;"Y: despues de ver la pelicula piensas mas que vas a tener superpoderes,";"1"
26.714;33.367;"entonces, como agarro a estos tres personajes que se ven tan: comunes, tan: normales, que tienen una relacion como de amigos muy realista, y darles estos superpo-";"1"
