"#starttime";"#endtime";"Speech";"sentimentAnnotations"
0.000;3.540;"mm: y- hara su efecto aunque: no lo notes";"1"
3.540;13.890;"pero lo que no me gusta de este: de este producto, es que cuando les das, a ver si lo puedo hacer, // sale muchi:simo, disparado en linea recta.";"-1"
13.890;21.122;"En vez de ser un spray que se difumine y te caiga mas producto en el pelo, te cae solamente en un sitio del pelo muchisima cantidad de producto.";"-1"
21.122;26.010;"Asi que: sera buen producto pero yo no: // eh: no me gusta ";"-1"
26.010;29.820;"Es que es mm: no me lo puedo echar bien por el pelo sin echarme muchisimo producto.";"-1"
29.820;31.765;"asi que, // no lo recomiendo si s-";"-1"
